都道府県名,市区町郡名,施設名,電話番号
東京,品川区,Crunch Studio,0364216561
東京,品川区,スタジオペンタ五反田店,0334472333
東京,品川区,スタジオベイド高輪店,0357890054
東京,品川区,クライネ ウィーン,0337792868
東京,品川区,スタジオ 音の木,
東京,品川区,サウンドスタジオノア 目黒不動前店,0369104550
東京,品川区,品川ピアノスタジオコローレ,
東京,品川区,JAMBOX - Jazz Music Studio,0337717283
東京,品川区,貸音楽スタジオサウンド・パーク,0337640928
東京,品川区,アワーハウス,0334517428
東京,品川区,ピアノスタジオノア 不動前店,0369104550
東京,目黒区,スタジオ・セラフィ,0364523314
東京,目黒区,TuneStudio,0357735744
東京,目黒区,STUDIO SEEZE,0368048133
東京,目黒区,ピアノスタジオノア 都立大店,0337250030
東京,目黒区,リンキィディンクスタジオ 都立大,0337187176
東京,目黒区,【東京パーカッション】打楽器レンタルスタジオSHINKI,05035521979
東京,目黒区,スタジオ リベルテ,0364259740
東京,目黒区,サウンドスタジオノア都立大店,0337250010
東京,目黒区,サウンドスタジオノア 学芸大店,0337102011
東京,目黒区,サウンドスタジオノア 自由が丘店,0357017700
東京,目黒区,"サウンドスタジオノア 池尻大橋店
",0334671101
東京,目黒区,スタジオブラート,0357784868
東京,目黒区,ムジク・ピアフォーヌ,0354520300
東京,目黒区,スタジオ ティエラ,0337153147
東京,世田谷区,世田谷スタジオ,03-5431-1701
東京,世田谷区,J’Z STUDIO 千歳烏山店,03-6909-1181
東京,世田谷区,世田谷アールイーシースタジオ,03-5313-8555
東京,世田谷区,リハーサルスタジオ シャッフル,03-3305-4419
東京,世田谷区,Rinky Dink Studio 梅ヶ丘,03-3420-3721
東京,世田谷区,studio09,03-5314-9119
東京,世田谷区,アンディーズスタジオ,03-5432-3805
東京,世田谷区,サウンドスタジオノア 三軒茶屋店,03-5432-7221
東京,世田谷区,TAD POLE STUDIO 経堂,03-3428-5711
東京,世田谷区,サウンドスタジオノア 駒沢店,03-5433-5711
東京,世田谷区,スタジオベイド 下北沢店,03-5432-0040
東京,世田谷区,北沢三丁目スタジオ,090-2632-9640
東京,世田谷区,studio LABO スタジオラボ,03-6314-0120
東京,世田谷区,マミューズ成城,070-6560-7747
東京,世田谷区,サウンドスタジオノア 下北沢店,03-3466-0058
東京,世田谷区,タッドポウルスタジオパート２,03-3290-5739
東京,世田谷区,梅ヶ丘のレコーディングスタジオ Studio CANTERA,03-5877-8916
東京,世田谷区,ガードアイランドスタジオ 下北沢南口店,03-3414-9833
東京,世田谷区,ガードアイランドスタジオ下北沢ＷＥＳＴ,03-5430-3334
東京,世田谷区,スタジオベイド自由が丘店,03-5701-0047
東京,世田谷区,リンキィディンクスタジオ 下北沢2nd,03-3466-0169
東京,世田谷区,オーキッドミュージックサロン,03-5797-5415
東京,世田谷区,ガードアイランドスタジオ,03-5300-4144
東京,世田谷区,スタジオセイント,03-3484-3561
東京,世田谷区,ピアノスタジオノア 下北沢店,03-5738-0212
東京,世田谷区,スタジオファミリア 三軒茶屋店,"03-6805-2131
"
東京,世田谷区,三軒茶屋 クロスロードスタジオ,03-3411-7041
東京,世田谷区,ピアノスタジオノア 駒沢店,03-5433-5712
,,,
